  1 0.000000000    127.0.0.1 → 127.0.0.1    TCP 74 52994→6653 [SYN] Seq=0 Win=43690 Len=0 MSS=65495 SACK_PERM=1 TSval=3353533 TSecr=0 WS=512
  2 0.000013756    127.0.0.1 → 127.0.0.1    TCP 74 6653→52994 [SYN, ACK] Seq=0 Ack=1 Win=43690 Len=0 MSS=65495 SACK_PERM=1 TSval=3353533 TSecr=3353533 WS=512
  3 0.000027939    127.0.0.1 → 127.0.0.1    TCP 66 52994→6653 [ACK] Seq=1 Ack=1 Win=44032 Len=0 TSval=3353533 TSecr=3353533
  4 0.004674292    127.0.0.1 → 127.0.0.1    TCP 66 52994→6653 [FIN, ACK] Seq=1 Ack=1 Win=44032 Len=0 TSval=3353534 TSecr=3353533
  5 0.005927607    127.0.0.1 → 127.0.0.1    TCP 66 6653→52994 [ACK] Seq=1 Ack=2 Win=44032 Len=0 TSval=3353535 TSecr=3353534
  6 0.072169417    127.0.0.1 → 127.0.0.1    OpenFlow 82 
  7 0.072613971    127.0.0.1 → 127.0.0.1    TCP 54 52994→6653 [RST] Seq=2 Win=0 Len=0
  8 0.310431326    127.0.0.1 → 127.0.0.1    TCP 74 52995→6653 [SYN] Seq=0 Win=43690 Len=0 MSS=65495 SACK_PERM=1 TSval=3353611 TSecr=0 WS=512
  9 0.310444049    127.0.0.1 → 127.0.0.1    TCP 74 6653→52995 [SYN, ACK] Seq=0 Ack=1 Win=43690 Len=0 MSS=65495 SACK_PERM=1 TSval=3353611 TSecr=3353611 WS=512
 10 0.310454243    127.0.0.1 → 127.0.0.1    TCP 66 52995→6653 [ACK] Seq=1 Ack=1 Win=44032 Len=0 TSval=3353611 TSecr=3353611
 11 0.316159732    127.0.0.1 → 127.0.0.1    OpenFlow 74 Type: OFPT_HELLO
 12 0.316185365    127.0.0.1 → 127.0.0.1    TCP 66 6653→52995 [ACK] Seq=1 Ack=9 Win=44032 Len=0 TSval=3353612 TSecr=3353612
 13 0.343732435    127.0.0.1 → 127.0.0.1    OpenFlow 82 
 14 0.343762901    127.0.0.1 → 127.0.0.1    TCP 66 52995→6653 [ACK] Seq=9 Ack=17 Win=44032 Len=0 TSval=3353619 TSecr=3353619
 15 0.353846953    127.0.0.1 → 127.0.0.1    OpenFlow 74 Type: OFPT_FEATURES_REQUEST
 16 0.353884487    127.0.0.1 → 127.0.0.1    TCP 66 52995→6653 [ACK] Seq=9 Ack=25 Win=44032 Len=0 TSval=3353622 TSecr=3353622
 17 0.353984344    127.0.0.1 → 127.0.0.1    OpenFlow 290 Type: OFPT_FEATURES_REPLY
 18 0.357130309           :: → ff02::1:ff85:c074 OpenFlow 162 Type: OFPT_PACKET_IN
 19 0.357768725    127.0.0.1 → 127.0.0.1    TCP 66 6653→52995 [ACK] Seq=25 Ack=329 Win=45056 Len=0 TSval=3353623 TSecr=3353622
 20 0.390984797           :: → ff02::1:ff6d:cd89 OpenFlow 162 Type: OFPT_PACKET_IN
 21 0.414264045           :: → ff02::16     OpenFlow 174 Type: OFPT_PACKET_IN
 22 0.425050260    127.0.0.1 → 127.0.0.1    TCP 174 [TCP Retransmission] 52995→6653 [PSH, ACK] Seq=425 Ack=25 Win=44032 Len=108 TSval=3353640 TSecr=3353623
 23 0.425090537    127.0.0.1 → 127.0.0.1    TCP 78 6653→52995 [ACK] Seq=25 Ack=533 Win=45056 Len=0 TSval=3353640 TSecr=3353631 SLE=425 SRE=533
 24 0.439690070    127.0.0.1 → 127.0.0.1    OpenFlow 94 Type: OFPT_GET_CONFIG_REQUEST
 25 0.439807840    127.0.0.1 → 127.0.0.1    OpenFlow 74 Type: OFPT_BARRIER_REPLY
 26 0.439825751    127.0.0.1 → 127.0.0.1    OpenFlow 78 Type: OFPT_GET_CONFIG_REPLY
 27 0.440103073    127.0.0.1 → 127.0.0.1    TCP 66 6653→52995 [ACK] Seq=53 Ack=553 Win=45056 Len=0 TSval=3353643 TSecr=3353643
 28 0.449803820    127.0.0.1 → 127.0.0.1    OpenFlow 78 Type: OFPT_STATS_REQUEST
 29 0.450045970    127.0.0.1 → 127.0.0.1    OpenFlow 1134 Type: OFPT_STATS_REPLY
 30 0.473790556    127.0.0.1 → 127.0.0.1    OpenFlow 86 Type: OFPT_VENDOR
 31 0.473913931    127.0.0.1 → 127.0.0.1    OpenFlow 86 Type: OFPT_VENDOR
 32 0.498826188    127.0.0.1 → 127.0.0.1    OpenFlow 138 Type: OFPT_FLOW_MOD
 33 0.500065291    127.0.0.1 → 127.0.0.1    OpenFlow 74 Type: OFPT_BARRIER_REQUEST
 34 0.500291959    127.0.0.1 → 127.0.0.1    TCP 66 52995→6653 [ACK] Seq=1641 Ack=165 Win=44032 Len=0 TSval=3353658 TSecr=3353658
 35 0.500316476    127.0.0.1 → 127.0.0.1    OpenFlow 74 Type: OFPT_BARRIER_REPLY
 36 0.502113421    127.0.0.1 → 127.0.0.1    OpenFlow 74 Type: OFPT_BARRIER_REQUEST
 37 0.502214865    127.0.0.1 → 127.0.0.1    OpenFlow 74 Type: OFPT_BARRIER_REPLY
 38 0.507393284 22:e2:d4:71:cc:71 → LLDP_Multicast OpenFlow 165 Type: OFPT_PACKET_OUT
 39 0.508469826 92:55:c2:bf:54:b9 → LLDP_Multicast OpenFlow 165 Type: OFPT_PACKET_OUT
 40 0.508536787    127.0.0.1 → 127.0.0.1    TCP 66 52995→6653 [ACK] Seq=1657 Ack=371 Win=44032 Len=0 TSval=3353660 TSecr=3353660
 41 0.586598331 22:e2:d4:71:cc:71 → Broadcast    OpenFlow 173 Type: OFPT_PACKET_OUT
 42 0.587286298 92:55:c2:bf:54:b9 → Broadcast    OpenFlow 173 Type: OFPT_PACKET_OUT
 43 0.587339061    127.0.0.1 → 127.0.0.1    TCP 66 52995→6653 [ACK] Seq=1657 Ack=585 Win=44032 Len=0 TSval=3353680 TSecr=3353680
 44 0.723016102           :: → ff02::16     OpenFlow 174 Type: OFPT_PACKET_IN
 45 0.763111538           :: → ff02::16     OpenFlow 180 Type: OFPT_PACKET_OUT
 46 0.763398990    127.0.0.1 → 127.0.0.1    OpenFlow 90 Type: OFPT_PACKET_OUT
 47 0.763445466    127.0.0.1 → 127.0.0.1    TCP 66 52995→6653 [ACK] Seq=1765 Ack=723 Win=44032 Len=0 TSval=3353724 TSecr=3353723
 48 0.853284867           :: → ff02::16     OpenFlow 174 Type: OFPT_PACKET_IN
 49 0.892940413    127.0.0.1 → 127.0.0.1    TCP 66 6653→52995 [ACK] Seq=723 Ack=1873 Win=47104 Len=0 TSval=3353757 TSecr=3353747
 50 0.925337291           :: → ff02::1:ffe8:6ad7 OpenFlow 162 Type: OFPT_PACKET_IN
 51 0.925371020    127.0.0.1 → 127.0.0.1    TCP 66 6653→52995 [ACK] Seq=723 Ack=1969 Win=47104 Len=0 TSval=3353765 TSecr=3353765
 52 0.927433153           :: → ff02::1:ffe8:6ad7 OpenFlow 168 Type: OFPT_PACKET_OUT
 53 0.928463022    127.0.0.1 → 127.0.0.1    OpenFlow 90 Type: OFPT_PACKET_OUT
 54 0.928529227    127.0.0.1 → 127.0.0.1    TCP 66 52995→6653 [ACK] Seq=1969 Ack=849 Win=44032 Len=0 TSval=3353765 TSecr=3353765
 55 0.929080833           :: → ff02::16     OpenFlow 174 Type: OFPT_PACKET_IN
 56 0.933174069           :: → ff02::16     OpenFlow 180 Type: OFPT_PACKET_OUT
 57 0.933529599    127.0.0.1 → 127.0.0.1    OpenFlow 90 Type: OFPT_PACKET_OUT
 58 0.933576981    127.0.0.1 → 127.0.0.1    TCP 66 52995→6653 [ACK] Seq=2077 Ack=987 Win=44032 Len=0 TSval=3353767 TSecr=3353766
 59 0.991053673 02:99:d9:6d:cd:89 → Broadcast    OpenFlow 126 Type: OFPT_PACKET_IN
 60 1.029977846    127.0.0.1 → 127.0.0.1    TCP 66 6653→52995 [ACK] Seq=987 Ack=2137 Win=47104 Len=0 TSval=3353791 TSecr=3353781
 61 1.178388351    127.0.0.1 → 127.0.0.1    OpenFlow 130 Type: OFPT_PORT_STATUS
 62 1.178440826    127.0.0.1 → 127.0.0.1    TCP 66 6653→52995 [ACK] Seq=987 Ack=2201 Win=47104 Len=0 TSval=3353828 TSecr=3353828
 63 1.186735538 da:0c:90:3e:de:07 → LLDP_Multicast OpenFlow 165 Type: OFPT_PACKET_OUT
 64 1.192735100 da:0c:90:3e:de:07 → Broadcast    OpenFlow 173 Type: OFPT_PACKET_OUT
 65 1.192977385    127.0.0.1 → 127.0.0.1    TCP 66 52995→6653 [ACK] Seq=2201 Ack=1193 Win=44032 Len=0 TSval=3353832 TSecr=3353830
 66 1.293316259 fe80::fcc6:72ff:fee2:ad5d → ff02::16     OpenFlow 174 Type: OFPT_PACKET_IN
 67 1.293358041 fe80::fcc6:72ff:fee2:ad5d → ff02::2      OpenFlow 154 Type: OFPT_PACKET_IN
 68 1.293675048    127.0.0.1 → 127.0.0.1    TCP 66 6653→52995 [ACK] Seq=1193 Ack=2397 Win=47104 Len=0 TSval=3353857 TSecr=3353857
 69 1.301859612 fe80::fcc6:72ff:fee2:ad5d → ff02::16     OpenFlow 180 Type: OFPT_PACKET_OUT
 70 1.302417229    127.0.0.1 → 127.0.0.1    OpenFlow 90 Type: OFPT_PACKET_OUT
 71 1.302480814    127.0.0.1 → 127.0.0.1    TCP 66 52995→6653 [ACK] Seq=2397 Ack=1331 Win=44032 Len=0 TSval=3353859 TSecr=3353858
 72 1.302685516 fe80::fcc6:72ff:fee2:ad5d → ff02::2      OpenFlow 160 Type: OFPT_PACKET_OUT
 73 1.302886917    127.0.0.1 → 127.0.0.1    OpenFlow 90 Type: OFPT_PACKET_OUT
 74 1.302921763    127.0.0.1 → 127.0.0.1    TCP 66 52995→6653 [ACK] Seq=2397 Ack=1449 Win=44032 Len=0 TSval=3353859 TSecr=3353859
 75 1.358770974 fe80::40e1:1bff:fe85:c074 → ff02::16     OpenFlow 174 Type: OFPT_PACKET_IN
 76 1.358827849 fe80::40e1:1bff:fe85:c074 → ff02::2      OpenFlow 154 Type: OFPT_PACKET_IN
 77 1.359207924    127.0.0.1 → 127.0.0.1    TCP 66 6653→52995 [ACK] Seq=1449 Ack=2593 Win=47104 Len=0 TSval=3353873 TSecr=3353873
 78 1.361884648 fe80::40e1:1bff:fe85:c074 → ff02::16     OpenFlow 180 Type: OFPT_PACKET_OUT
 79 1.362860159    127.0.0.1 → 127.0.0.1    OpenFlow 90 Type: OFPT_PACKET_OUT
 80 1.362956731    127.0.0.1 → 127.0.0.1    TCP 66 52995→6653 [ACK] Seq=2593 Ack=1587 Win=44032 Len=0 TSval=3353874 TSecr=3353874
 81 1.363234787 fe80::40e1:1bff:fe85:c074 → ff02::2      OpenFlow 160 Type: OFPT_PACKET_OUT
 82 1.363491858    127.0.0.1 → 127.0.0.1    OpenFlow 90 Type: OFPT_PACKET_OUT
 83 1.363537034    127.0.0.1 → 127.0.0.1    TCP 66 52995→6653 [ACK] Seq=2593 Ack=1705 Win=44032 Len=0 TSval=3353874 TSecr=3353874
 84 1.390213138 fe80::99:d9ff:fe6d:cd89 → ff02::16     OpenFlow 174 Type: OFPT_PACKET_IN
 85 1.390300600 fe80::99:d9ff:fe6d:cd89 → ff02::2      OpenFlow 154 Type: OFPT_PACKET_IN
 86 1.390690358    127.0.0.1 → 127.0.0.1    TCP 66 6653→52995 [ACK] Seq=1705 Ack=2789 Win=47104 Len=0 TSval=3353881 TSecr=3353881
 87 1.396235972 fe80::99:d9ff:fe6d:cd89 → ff02::16     OpenFlow 180 Type: OFPT_PACKET_OUT
 88 1.396679524    127.0.0.1 → 127.0.0.1    OpenFlow 90 Type: OFPT_PACKET_OUT
 89 1.396726156    127.0.0.1 → 127.0.0.1    TCP 66 52995→6653 [ACK] Seq=2789 Ack=1843 Win=44032 Len=0 TSval=3353882 TSecr=3353882
 90 1.396981799 fe80::99:d9ff:fe6d:cd89 → ff02::2      OpenFlow 160 Type: OFPT_PACKET_OUT
 91 1.400547711    127.0.0.1 → 127.0.0.1    OpenFlow 90 Type: OFPT_PACKET_OUT
 92 1.400641744    127.0.0.1 → 127.0.0.1    TCP 66 52995→6653 [ACK] Seq=2789 Ack=1961 Win=44032 Len=0 TSval=3353883 TSecr=3353883
 93 1.709189274 fe80::40e1:1bff:fe85:c074 → ff02::16     OpenFlow 174 Type: OFPT_PACKET_IN
 94 1.711494125 fe80::40e1:1bff:fe85:c074 → ff02::16     OpenFlow 180 Type: OFPT_PACKET_OUT
 95 1.712008409    127.0.0.1 → 127.0.0.1    OpenFlow 90 Type: OFPT_PACKET_OUT
 96 1.712062098    127.0.0.1 → 127.0.0.1    TCP 66 52995→6653 [ACK] Seq=2897 Ack=2099 Win=44032 Len=0 TSval=3353961 TSecr=3353961
 97 1.925317746 fe80::f883:acff:fee8:6ad7 → ff02::16     OpenFlow 174 Type: OFPT_PACKET_IN
 98 1.925375638 fe80::f883:acff:fee8:6ad7 → ff02::2      OpenFlow 154 Type: OFPT_PACKET_IN
 99 1.929098975    127.0.0.1 → 127.0.0.1    TCP 66 6653→52995 [ACK] Seq=2099 Ack=3093 Win=47104 Len=0 TSval=3354016 TSecr=3354015
100 1.948848472 fe80::f883:acff:fee8:6ad7 → ff02::16     OpenFlow 180 Type: OFPT_PACKET_OUT
101 1.949409787    127.0.0.1 → 127.0.0.1    OpenFlow 90 Type: OFPT_PACKET_OUT
102 1.949463627    127.0.0.1 → 127.0.0.1    TCP 66 52995→6653 [ACK] Seq=3093 Ack=2237 Win=44032 Len=0 TSval=3354021 TSecr=3354020
103 1.950093491 fe80::f883:acff:fee8:6ad7 → ff02::2      OpenFlow 160 Type: OFPT_PACKET_OUT
104 1.950464659    127.0.0.1 → 127.0.0.1    OpenFlow 90 Type: OFPT_PACKET_OUT
105 1.950512072    127.0.0.1 → 127.0.0.1    TCP 66 52995→6653 [ACK] Seq=3093 Ack=2355 Win=44032 Len=0 TSval=3354021 TSecr=3354021
106 1.989223054 02:99:d9:6d:cd:89 → Broadcast    OpenFlow 126 Type: OFPT_PACKET_IN
107 1.993511472 02:99:d9:6d:cd:89 → Broadcast    OpenFlow 132 Type: OFPT_PACKET_OUT
108 1.993885429 fe:c6:72:e2:ad:5d → 02:99:d9:6d:cd:89 OpenFlow 126 Type: OFPT_PACKET_IN
109 1.995628553    127.0.0.1 → 127.0.0.1    OpenFlow 90 Type: OFPT_PACKET_OUT
110 1.995782216 fe:c6:72:e2:ad:5d → 02:99:d9:6d:cd:89 OpenFlow 126 Type: OFPT_PACKET_IN
111 2.017697058    127.0.0.1 → 127.0.0.1    OpenFlow 146 Type: OFPT_FLOW_MOD
112 2.018413677    127.0.0.1 → 127.0.0.1    OpenFlow 90 Type: OFPT_PACKET_OUT
113 2.018464780    127.0.0.1 → 127.0.0.1    TCP 66 52995→6653 [ACK] Seq=3273 Ack=2549 Win=44032 Len=0 TSval=3354037 TSecr=3354037
114 2.019225522     10.0.0.1 → 10.0.0.2     OpenFlow 182 Type: OFPT_PACKET_IN
115 2.019609191    127.0.0.1 → 127.0.0.1    OpenFlow 90 Type: OFPT_PACKET_OUT
116 2.019728947    127.0.0.1 → 127.0.0.1    OpenFlow 102 Type: OFPT_ERROR
117 2.020336767    127.0.0.1 → 127.0.0.1    OpenFlow 146 Type: OFPT_FLOW_MOD
118 2.020947299    127.0.0.1 → 127.0.0.1    OpenFlow 90 Type: OFPT_PACKET_OUT
119 2.021007319    127.0.0.1 → 127.0.0.1    TCP 66 52995→6653 [ACK] Seq=3425 Ack=2677 Win=44032 Len=0 TSval=3354038 TSecr=3354038
120 2.021236331    127.0.0.1 → 127.0.0.1    OpenFlow 90 Type: OFPT_PACKET_OUT
121 2.021308869    127.0.0.1 → 127.0.0.1    OpenFlow 102 Type: OFPT_ERROR
122 2.031803809    127.0.0.1 → 127.0.0.1    OpenFlow 146 Type: OFPT_FLOW_MOD
123 2.033199438    127.0.0.1 → 127.0.0.1    OpenFlow 90 Type: OFPT_PACKET_OUT
124 2.033305874    127.0.0.1 → 127.0.0.1    TCP 66 52995→6653 [ACK] Seq=3461 Ack=2805 Win=44032 Len=0 TSval=3354042 TSecr=3354041
125 2.033649860     10.0.0.2 → 10.0.0.1     OpenFlow 182 Type: OFPT_PACKET_IN
126 2.033988535    127.0.0.1 → 127.0.0.1    OpenFlow 90 Type: OFPT_PACKET_OUT
127 2.034073853    127.0.0.1 → 127.0.0.1    OpenFlow 102 Type: OFPT_ERROR
128 2.036505634    127.0.0.1 → 127.0.0.1    OpenFlow 146 Type: OFPT_FLOW_MOD
129 2.037038626    127.0.0.1 → 127.0.0.1    OpenFlow 90 Type: OFPT_PACKET_OUT
130 2.037086192    127.0.0.1 → 127.0.0.1    TCP 66 52995→6653 [ACK] Seq=3613 Ack=2933 Win=44032 Len=0 TSval=3354042 TSecr=3354042
131 2.038432243    127.0.0.1 → 127.0.0.1    OpenFlow 90 Type: OFPT_PACKET_OUT
132 2.038538186    127.0.0.1 → 127.0.0.1    OpenFlow 102 Type: OFPT_ERROR
133 2.041491744 02:99:d9:6d:cd:89 → Broadcast    OpenFlow 126 Type: OFPT_PACKET_IN
134 2.041713015    127.0.0.1 → 127.0.0.1    TCP 66 6653→52995 [ACK] Seq=2957 Ack=3709 Win=47104 Len=0 TSval=3354044 TSecr=3354043
135 2.047256108 02:99:d9:6d:cd:89 → Broadcast    OpenFlow 132 Type: OFPT_PACKET_OUT
136 2.047572590 fa:83:ac:e8:6a:d7 → 02:99:d9:6d:cd:89 OpenFlow 126 Type: OFPT_PACKET_IN
137 2.047760227    127.0.0.1 → 127.0.0.1    OpenFlow 90 Type: OFPT_PACKET_OUT
138 2.047908089 fa:83:ac:e8:6a:d7 → 02:99:d9:6d:cd:89 OpenFlow 126 Type: OFPT_PACKET_IN
139 2.054041368    127.0.0.1 → 127.0.0.1    OpenFlow 146 Type: OFPT_FLOW_MOD
140 2.055132457    127.0.0.1 → 127.0.0.1    OpenFlow 90 Type: OFPT_PACKET_OUT
141 2.055332995    127.0.0.1 → 127.0.0.1    TCP 66 52995→6653 [ACK] Seq=3829 Ack=3151 Win=44032 Len=0 TSval=3354047 TSecr=3354047
142 2.055696724     10.0.0.1 → 10.0.0.3     OpenFlow 182 Type: OFPT_PACKET_IN
143 2.058287695    127.0.0.1 → 127.0.0.1    OpenFlow 90 Type: OFPT_PACKET_OUT
144 2.058427923    127.0.0.1 → 127.0.0.1    OpenFlow 102 Type: OFPT_ERROR
145 2.058722823    127.0.0.1 → 127.0.0.1    OpenFlow 146 Type: OFPT_FLOW_MOD
146 2.058964136    127.0.0.1 → 127.0.0.1    OpenFlow 90 Type: OFPT_PACKET_OUT
147 2.059001436    127.0.0.1 → 127.0.0.1    TCP 66 52995→6653 [ACK] Seq=3981 Ack=3279 Win=44032 Len=0 TSval=3354048 TSecr=3354048
148 2.059169885    127.0.0.1 → 127.0.0.1    OpenFlow 90 Type: OFPT_PACKET_OUT
149 2.059222093    127.0.0.1 → 127.0.0.1    OpenFlow 102 Type: OFPT_ERROR
150 2.064104357    127.0.0.1 → 127.0.0.1    OpenFlow 146 Type: OFPT_FLOW_MOD
151 2.064515887    127.0.0.1 → 127.0.0.1    OpenFlow 90 Type: OFPT_PACKET_OUT
152 2.064553829    127.0.0.1 → 127.0.0.1    TCP 66 52995→6653 [ACK] Seq=4017 Ack=3407 Win=44032 Len=0 TSval=3354049 TSecr=3354049
153 2.064706218     10.0.0.3 → 10.0.0.1     OpenFlow 182 Type: OFPT_PACKET_IN
154 2.064864749    127.0.0.1 → 127.0.0.1    OpenFlow 90 Type: OFPT_PACKET_OUT
155 2.064928802    127.0.0.1 → 127.0.0.1    OpenFlow 102 Type: OFPT_ERROR
156 2.066969923    127.0.0.1 → 127.0.0.1    OpenFlow 146 Type: OFPT_FLOW_MOD
157 2.067307690    127.0.0.1 → 127.0.0.1    OpenFlow 90 Type: OFPT_PACKET_OUT
158 2.067346573    127.0.0.1 → 127.0.0.1    TCP 66 52995→6653 [ACK] Seq=4169 Ack=3535 Win=44032 Len=0 TSval=3354049 TSecr=3354049
159 2.068423595    127.0.0.1 → 127.0.0.1    OpenFlow 90 Type: OFPT_PACKET_OUT
160 2.068508365    127.0.0.1 → 127.0.0.1    OpenFlow 102 Type: OFPT_ERROR
161 2.071957212 fe:c6:72:e2:ad:5d → Broadcast    OpenFlow 126 Type: OFPT_PACKET_IN
162 2.073216738    127.0.0.1 → 127.0.0.1    TCP 66 6653→52995 [ACK] Seq=3559 Ack=4265 Win=47104 Len=0 TSval=3354052 TSecr=3354049
163 2.073877609 fe:c6:72:e2:ad:5d → Broadcast    OpenFlow 132 Type: OFPT_PACKET_OUT
164 2.074057865 fa:83:ac:e8:6a:d7 → fe:c6:72:e2:ad:5d OpenFlow 126 Type: OFPT_PACKET_IN
165 2.074509295    127.0.0.1 → 127.0.0.1    OpenFlow 90 Type: OFPT_PACKET_OUT
166 2.074631650 fa:83:ac:e8:6a:d7 → fe:c6:72:e2:ad:5d OpenFlow 126 Type: OFPT_PACKET_IN
167 2.077561484    127.0.0.1 → 127.0.0.1    OpenFlow 146 Type: OFPT_FLOW_MOD
168 2.078692577    127.0.0.1 → 127.0.0.1    OpenFlow 90 Type: OFPT_PACKET_OUT
169 2.078859493    127.0.0.1 → 127.0.0.1    TCP 66 52995→6653 [ACK] Seq=4385 Ack=3753 Win=44032 Len=0 TSval=3354053 TSecr=3354052
170 2.079066559     10.0.0.2 → 10.0.0.3     OpenFlow 182 Type: OFPT_PACKET_IN
171 2.079274026    127.0.0.1 → 127.0.0.1    OpenFlow 90 Type: OFPT_PACKET_OUT
172 2.079412992    127.0.0.1 → 127.0.0.1    OpenFlow 102 Type: OFPT_ERROR
173 2.079971583    127.0.0.1 → 127.0.0.1    OpenFlow 146 Type: OFPT_FLOW_MOD
174 2.080260964    127.0.0.1 → 127.0.0.1    OpenFlow 90 Type: OFPT_PACKET_OUT
175 2.080304097    127.0.0.1 → 127.0.0.1    TCP 66 52995→6653 [ACK] Seq=4537 Ack=3881 Win=44032 Len=0 TSval=3354053 TSecr=3354053
176 2.081397285    127.0.0.1 → 127.0.0.1    OpenFlow 90 Type: OFPT_PACKET_OUT
177 2.081522771    127.0.0.1 → 127.0.0.1    OpenFlow 102 Type: OFPT_ERROR
178 2.093606202    127.0.0.1 → 127.0.0.1    OpenFlow 146 Type: OFPT_FLOW_MOD
179 2.094094108    127.0.0.1 → 127.0.0.1    OpenFlow 90 Type: OFPT_PACKET_OUT
180 2.094133413    127.0.0.1 → 127.0.0.1    TCP 66 52995→6653 [ACK] Seq=4573 Ack=4009 Win=44032 Len=0 TSval=3354057 TSecr=3354057
181 2.094257856     10.0.0.3 → 10.0.0.2     OpenFlow 182 Type: OFPT_PACKET_IN
182 2.094384041    127.0.0.1 → 127.0.0.1    OpenFlow 90 Type: OFPT_PACKET_OUT
183 2.094473993    127.0.0.1 → 127.0.0.1    OpenFlow 102 Type: OFPT_ERROR
184 2.097326679    127.0.0.1 → 127.0.0.1    OpenFlow 146 Type: OFPT_FLOW_MOD
185 2.107961429    127.0.0.1 → 127.0.0.1    OpenFlow 90 Type: OFPT_PACKET_OUT
186 2.108062837    127.0.0.1 → 127.0.0.1    TCP 66 52995→6653 [ACK] Seq=4725 Ack=4137 Win=44032 Len=0 TSval=3354060 TSecr=3354057
187 2.111853164    127.0.0.1 → 127.0.0.1    OpenFlow 90 Type: OFPT_PACKET_OUT
188 2.112078265    127.0.0.1 → 127.0.0.1    OpenFlow 102 Type: OFPT_ERROR
189 2.148994392    127.0.0.1 → 127.0.0.1    TCP 66 6653→52995 [ACK] Seq=4161 Ack=4761 Win=47104 Len=0 TSval=3354071 TSecr=3354061
190 2.208074609    127.0.0.1 → 127.0.0.1    OpenFlow 130 Type: OFPT_PORT_STATUS
191 2.208287749    127.0.0.1 → 127.0.0.1    OpenFlow 130 Type: OFPT_PORT_STATUS
192 2.209703748    127.0.0.1 → 127.0.0.1    TCP 66 6653→52995 [ACK] Seq=4161 Ack=4889 Win=47104 Len=0 TSval=3354086 TSecr=3354085
193 2.274559052 fe80::fcc6:72ff:fee2:ad5d → ff02::16     OpenFlow 174 Type: OFPT_PACKET_IN
194 2.274926084    127.0.0.1 → 127.0.0.1    TCP 66 6653→52995 [ACK] Seq=4161 Ack=4997 Win=47104 Len=0 TSval=3354102 TSecr=3354102
195 2.276489971 fe80::fcc6:72ff:fee2:ad5d → ff02::16     OpenFlow 180 Type: OFPT_PACKET_OUT
196 2.276902990    127.0.0.1 → 127.0.0.1    OpenFlow 90 Type: OFPT_PACKET_OUT
197 2.276955278    127.0.0.1 → 127.0.0.1    TCP 66 52995→6653 [ACK] Seq=4997 Ack=4299 Win=44032 Len=0 TSval=3354102 TSecr=3354102
198 2.330239968 fe80::99:d9ff:fe6d:cd89 → ff02::16     OpenFlow 174 Type: OFPT_PACKET_IN
199 2.331573246 fe80::99:d9ff:fe6d:cd89 → ff02::16     OpenFlow 180 Type: OFPT_PACKET_OUT
200 2.336178924    127.0.0.1 → 127.0.0.1    OpenFlow 90 Type: OFPT_PACKET_OUT
201 2.336422629    127.0.0.1 → 127.0.0.1    TCP 66 52995→6653 [ACK] Seq=5105 Ack=4437 Win=44032 Len=0 TSval=3354117 TSecr=3354116
202 2.479092217    127.0.0.1 → 127.0.0.1    OpenFlow 130 Type: OFPT_PORT_STATUS
203 2.479161961    127.0.0.1 → 127.0.0.1    OpenFlow 130 Type: OFPT_PORT_STATUS
204 2.479371809    127.0.0.1 → 127.0.0.1    OpenFlow 130 Type: OFPT_PORT_STATUS
205 2.479646380    127.0.0.1 → 127.0.0.1    TCP 66 6653→52995 [ACK] Seq=4437 Ack=5297 Win=47104 Len=0 TSval=3354153 TSecr=3354153
206 3.374747434    127.0.0.1 → 127.0.0.1    TCP 66 52995→6653 [FIN, ACK] Seq=5297 Ack=4437 Win=44032 Len=0 TSval=3354377 TSecr=3354153
207 3.383226049    127.0.0.1 → 127.0.0.1    TCP 66 6653→52995 [FIN, ACK] Seq=4437 Ack=5298 Win=47104 Len=0 TSval=3354379 TSecr=3354377
208 3.383263864    127.0.0.1 → 127.0.0.1    TCP 66 52995→6653 [ACK] Seq=5298 Ack=4438 Win=44032 Len=0 TSval=3354379 TSecr=3354379
